<?xml version="1.0" encoding="UTF-8"?>
<!DOCTYPE system SYSTEM "minispec.dtd">
<system name="system">
	<entity name="Fourmisse">
		<attribute name="type">
			<type>
				<simpleType type="String" />
			</type>
		</attribute>
		<attribute name = "copains">
			<type>
				<collection type="List">
					<type>
						<collection type="Bag">
							<type>
								<simpleType type="Fourmisse" />
							</type>
						</collection>
					</type>
				</collection>
			</type>
		</attribute>
	</entity>
</system>